{
  "meta_info": {
    "scene_id": "gas_city_gate_dispatch_profit",
    "scene_type": "混合优化",
    "creator": "auto_gen_by_llm",
    "version": "v1.0.0",
    "create_time": "2023-10-27T10:00:00Z"
  },
  "data_def": {
    "tables": [
      {
        "table_name": "monthly_demand_pool",
        "fields": [
          {
            "name": "demand_plan_code",
            "type": "string",
            "desc": "需求计划编码",
            "is_required": true
          },
          {
            "name": "quantity",
            "type": "float",
            "desc": "需求量",
            "is_required": true
          },
          {
            "name": "unit_selling_price",
            "type": "float",
            "desc": "销售单价",
            "is_required": true
          },
          {
            "name": "minimum_satisfy_quantity",
            "type": "float",
            "desc": "最小满足量",
            "is_required": false,
            "default_value": 0
          }
        ],
        "primary_key": [
          "demand_plan_code"
        ]
      },
      {
        "table_name": "monthly_resource_pool",
        "fields": [
          {
            "name": "purchase_agreement_no",
            "type": "string",
            "desc": "采购合同号",
            "is_required": true
          },
          {
            "name": "quantity",
            "type": "float",
            "desc": "供应量上限",
            "is_required": true
          },
          {
            "name": "min_quantity",
            "type": "float",
            "desc": "最小提取量（照付不议基准）",
            "is_required": false,
            "default_value": 0
          },
          {
            "name": "unit_price",
            "type": "float",
            "desc": "资源单价",
            "is_required": true
          },
          {
            "name": "no_discuss_percent",
            "type": "float",
            "desc": "照付不议系数",
            "is_required": false,
            "default_value": 0
          }
        ],
        "primary_key": [
          "purchase_agreement_no"
        ]
      },
      {
        "table_name": "monthly_transport_pool",
        "fields": [
          {
            "name": "id",
            "type": "int",
            "desc": "主键ID",
            "is_required": true
          },
          {
            "name": "design_gas_capacity",
            "type": "float",
            "desc": "设计输气能力上限",
            "is_required": true
          },
          {
            "name": "unit_price",
            "type": "float",
            "desc": "管输单价",
            "is_required": true
          },
          {
            "name": "min_amount",
            "type": "float",
            "desc": "最小输气量",
            "is_required": false,
            "default_value": 0
          }
        ],
        "primary_key": [
          "id"
        ]
      },
      {
        "table_name": "ontology_city_gas_station_info",
        "fields": [
          {
            "name": "gate_station_code",
            "type": "string",
            "desc": "城燃门站编码",
            "is_required": true
          },
          {
            "name": "upper_bound",
            "type": "float",
            "desc": "门站业务上限",
            "is_required": false
          },
          {
            "name": "lower_bound",
            "type": "float",
            "desc": "门站业务下限",
            "is_required": false
          }
        ],
        "primary_key": [
          "gate_station_code"
        ]
      }
    ],
    "index_sets": [
      {
        "set_name": "DEMAND_IDS",
        "source": "monthly_demand_pool.demand_plan_code",
        "desc": "需求计划ID集合"
      },
      {
        "set_name": "RESOURCE_IDS",
        "source": "monthly_resource_pool.purchase_agreement_no",
        "desc": "资源采购合同ID集合"
      },
      {
        "set_name": "TRANSPORT_IDS",
        "source": "monthly_transport_pool.id",
        "desc": "管输运力ID集合"
      },
      {
        "set_name": "STATION_IDS",
        "source": "ontology_city_gas_station_info.gate_station_code",
        "desc": "城燃门站ID集合"
      },
      {
        "set_name": "FEASIBLE_PATHS",
        "source": "path_query.paths",
        "desc": "可行路径集合，每个元素为[资源节点ID, 边ID, ..., 门站节点ID, 边ID, 需求节点ID]的列表"
      }
    ],
    "parameters": [
      {
        "param_name": "PARAM_DEMAND_QUANTITY",
        "source": "monthly_demand_pool.quantity",
        "index_sets": [
          "DEMAND_IDS"
        ],
        "data_type": "float",
        "desc": "需求计划量"
      },
      {
        "param_name": "PARAM_SELLING_PRICE",
        "source": "monthly_demand_pool.unit_selling_price",
        "index_sets": [
          "DEMAND_IDS"
        ],
        "data_type": "float",
        "desc": "销售单价"
      },
      {
        "param_name": "PARAM_MIN_DEMAND_QTY",
        "source": "monthly_demand_pool.minimum_satisfy_quantity",
        "index_sets": [
          "DEMAND_IDS"
        ],
        "data_type": "float",
        "desc": "最小需求满足量"
      },
      {
        "param_name": "PARAM_RESOURCE_CAPACITY",
        "source": "monthly_resource_pool.quantity",
        "index_sets": [
          "RESOURCE_IDS"
        ],
        "data_type": "float",
        "desc": "资源供应上限"
      },
      {
        "param_name": "PARAM_RESOURCE_MIN_QTY",
        "source": "monthly_resource_pool.min_quantity",
        "index_sets": [
          "RESOURCE_IDS"
        ],
        "data_type": "float",
        "desc": "资源最小提取量（照付不议基准）"
      },
      {
        "param_name": "PARAM_RESOURCE_PRICE",
        "source": "monthly_resource_pool.unit_price",
        "index_sets": [
          "RESOURCE_IDS"
        ],
        "data_type": "float",
        "desc": "资源采购单价"
      },
      {
        "param_name": "PARAM_TAKE_OR_PAY_RATIO",
        "source": "monthly_resource_pool.no_discuss_percent",
        "index_sets": [
          "RESOURCE_IDS"
        ],
        "data_type": "float",
        "desc": "照付不议惩罚系数"
      },
      {
        "param_name": "PARAM_TRANSPORT_CAPACITY",
        "source": "monthly_transport_pool.design_gas_capacity",
        "index_sets": [
          "TRANSPORT_IDS"
        ],
        "data_type": "float",
        "desc": "管输设计能力上限"
      },
      {
        "param_name": "PARAM_TRANSPORT_PRICE",
        "source": "monthly_transport_pool.unit_price",
        "index_sets": [
          "TRANSPORT_IDS"
        ],
        "data_type": "float",
        "desc": "管输单价"
      },
      {
        "param_name": "PARAM_TRANSPORT_MIN_AMOUNT",
        "source": "monthly_transport_pool.min_amount",
        "index_sets": [
          "TRANSPORT_IDS"
        ],
        "data_type": "float",
        "desc": "管输最小输气量"
      },
      {
        "param_name": "PARAM_STATION_UPPER_BOUND",
        "source": "ontology_city_gas_station_info.upper_bound",
        "index_sets": [
          "STATION_IDS"
        ],
        "data_type": "float",
        "desc": "门站业务上限"
      },
      {
        "param_name": "PARAM_STATION_LOWER_BOUND",
        "source": "ontology_city_gas_station_info.lower_bound",
        "index_sets": [
          "STATION_IDS"
        ],
        "data_type": "float",
        "desc": "门站业务下限"
      }
    ],
    "links": []
  },
  "decision_vars": [
    {
      "var_name": "VAR_PATH_FLOW",
      "var_type": "continuous",
      "index_sets": [
        "FEASIBLE_PATHS"
      ],
      "lower_bound": 0,
      "desc": "路径上的天然气流量"
    }
  ],
  "objective": {
    "obj_type": "maximize",
    "obj_terms": [
      {
        "term_name": "TERM_SALES_REVENUE",
        "expression": "sum(VAR_PATH_FLOW[p] * PARAM_SELLING_PRICE[p[-1]] for p in FEASIBLE_PATHS)",
        "coefficient": 1,
        "desc": "销售收入：路径流量 * 终点销售单价"
      },
      {
        "term_name": "TERM_RESOURCE_COST",
        "expression": "sum(VAR_PATH_FLOW[p] * PARAM_RESOURCE_PRICE[p[0]] for p in FEASIBLE_PATHS)",
        "coefficient": -1,
        "desc": "资源采购成本：路径流量 * 起点资源单价"
      },
      {
        "term_name": "TERM_TRANSPORT_COST",
        "expression": "sum(VAR_PATH_FLOW[p] * sum(PARAM_TRANSPORT_PRICE[e] for e in p if type(e)==int and e in TRANSPORT_IDS) for p in FEASIBLE_PATHS)",
        "coefficient": -1,
        "desc": "管输运力成本：路径流量 * 路径上所有边的管输单价之和"
      },
      {
        "term_name": "TERM_TAKE_OR_PAY_PENALTY",
        "expression": "sum(max(0, PARAM_RESOURCE_MIN_QTY[r] - sum(VAR_PATH_FLOW[p] for p in FEASIBLE_PATHS if p[0] == r)) * PARAM_RESOURCE_PRICE[r] * PARAM_TAKE_OR_PAY_RATIO[r] for r in RESOURCE_IDS)",
        "coefficient": -1,
        "desc": "照付不议惩罚成本：(最小提取量 - 实际提取量) * 单价 * 系数"
      }
    ],
    "desc": "最大化总利润 = 销售收入 - 资源成本 - 运输成本 - 照付不议惩罚"
  },
  "constraints": [
    {
      "constraint_id": "CONST_RESOURCE_CAPACITY",
      "constraint_type": "inequality",
      "direction": "<=",
      "left_expression": "sum(VAR_PATH_FLOW[p] for p in FEASIBLE_PATHS if p[0] == r)",
      "right_expression": "PARAM_RESOURCE_CAPACITY[r]",
      "index_sets": [
        "RESOURCE_IDS"
      ],
      "priority": 1,
      "desc": "资源供应上限约束：从资源r出发的流量总和不超过资源上限"
    },
    {
      "constraint_id": "CONST_DEMAND_CAPACITY",
      "constraint_type": "inequality",
      "direction": "<=",
      "left_expression": "sum(VAR_PATH_FLOW[p] for p in FEASIBLE_PATHS if p[-1] == d)",
      "right_expression": "PARAM_DEMAND_QUANTITY[d]",
      "index_sets": [
        "DEMAND_IDS"
      ],
      "priority": 1,
      "desc": "需求满足上限约束：到达需求d的流量总和不超过需求计划量"
    },
    {
      "constraint_id": "CONST_TRANSPORT_CAPACITY",
      "constraint_type": "inequality",
      "direction": "<=",
      "left_expression": "sum(VAR_PATH_FLOW[p] for p in FEASIBLE_PATHS if t in p)",
      "right_expression": "PARAM_TRANSPORT_CAPACITY[t]",
      "index_sets": [
        "TRANSPORT_IDS"
      ],
      "priority": 1,
      "desc": "管输运力上限约束：经过管道t的流量总和不超过设计能力"
    },
    {
      "constraint_id": "CONST_STATION_CAPACITY",
      "constraint_type": "inequality",
      "direction": "<=",
      "left_expression": "sum(VAR_PATH_FLOW[p] for p in FEASIBLE_PATHS if s in p)",
      "right_expression": "PARAM_STATION_UPPER_BOUND[s]",